service,path,description
onetrust-mt5-processor,/Users/kittiphong/Desktop/codes/go/onetrust-mt5-processor,"บริการประมวลผลข้อมูลจาก MT5 — รับ deal in/out ผ่าน Kafka, จับคู่ position ที่ปิดสมบูรณ์ (100% closed), และบันทึก trading balance ลงฐานข้อมูลฝั่ง trading"
onetrust-financial-service,/Users/kittiphong/Desktop/codes/go/onetrust-finance-service,บริการทางการเงิน (Kafka-only) — คำนวณและบันทึก IB rebate ตาม flow calculate → accrual → settlement; ในอนาคตจะครอบคลุม deposit / withdraw / internal transfer และ double-entry ledger
onetrust-archived,/Users/kittiphong/Desktop/codes/go/onetrust-archiver,"บริการ archive ข้อมูล (sink-only) — consume Kafka events แล้ว INSERT เป็น batch ลง ClickHouse 2 instance (client = trading, ib = financial) เพื่อใช้งาน analytics; ไม่เขียนกลับ Postgres และไม่ produce event ใหม่"
onetrust-client-portal-api,/Users/kittiphong/Desktop/codes/go/onetrust-client-portal-api,"REST API หลักของ Client Portal (Fiber + GORM + JWT) — แยกเป็น 3 server (Client / Admin / Partner-IB) ครอบคลุม auth, user, trading account, cashier, IB และ admin; เป็นเจ้าของ master data, setting และ users ทั้งหมด"
aeternixth-go-lib,/Users/kittiphong/Desktop/codes/go/aeternixth-go-lib,"Shared Go library (Fiber-based) — รวม utility packages ที่ใช้ร่วมกันใน backend services ครอบคลุม decimal สำหรับงานการเงิน, JWT + bcrypt auth, Fiber middleware/helpers, validator, sentinel errors, pagination, rate limit และ integration กับ AWS S3 / Gmail; ลด boilerplate ในการสร้าง service ใหม่"
onetrust-mt5-proxy-api,/Users/kittiphong/Desktop/codes/go/onetrust-mt5-proxy-api,"REST API proxy หน้า MT5 Web API (Fiber) — รับคำสั่งจาก service ภายในผ่าน X-API-Key แล้ว forward ไป MT5 Manager โดยจัดการ two-step handshake auth, session reconnect, circuit breaker และ transparent pagination ให้เอง; ครอบคลุม account CRUD, deposit/withdraw, positions, deals และ reference data (users/groups/symbols)"